{"schema_version":"1.1.0","data_classification":"SYNTHETIC_ONLY","treatment_episode_id":"SYNTH_EP_01","patient_uid":"SYNTH_P_001","study_id":"SYNTH_STUDY","regimen_id":"SYNTH_REGIMEN","index_event":"synthetic index start; not clinical evidence","start_day":0,"stop_day":null,"timing_precision":"EXACT","prior_ici":"UNKNOWN","episode_status":"BLOCKED_UNKNOWN","component_exposure_ids":[],"source_locators":["urn:synthetic:contract-fixture"],"notes":"This is a synthetic schema fixture, not a patient or admission."}
